<?xml version="1.0" encoding="UTF-8"?>
<books xmlns:xsi="http://www.w3.org/2001/XMLSchema-instance"
       xmlns="http://kushel.it-academy.by/xml/books"
       xsi:schemaLocation="http://kushel.it-academy.by/xml/books book.xsd">
    <book number="0001">
        <name>Java 8</name>
        <autor>Schildt</autor>
        <genre>technical publications</genre>
        <numberOfPages>999</numberOfPages>
        <publicationDate>2015</publicationDate>
        <volume>1</volume>
        <number>
            <numberOfBooksInLibrary>5</numberOfBooksInLibrary>
            <numberOfAvailableBooks>5</numberOfAvailableBooks>
        </number>
    </book>

    <book number="0002">
        <name>Java 2</name>
        <autor>Horstmann</autor>
        <genre>technical publications</genre>
        <numberOfPages>600</numberOfPages>
        <publicationDate>2010</publicationDate>
        <volume>1</volume>
        <number>
            <numberOfBooksInLibrary>3</numberOfBooksInLibrary>
            <numberOfAvailableBooks>3</numberOfAvailableBooks>
        </number>
    </book>
    <book number="0003">
        <name>Java 2</name>
        <autor>Horstmann</autor>
        <genre>technical publications</genre>
        <numberOfPages>590</numberOfPages>
        <publicationDate>2010</publicationDate>
        <volume>2</volume>
        <number>
            <numberOfBooksInLibrary>3</numberOfBooksInLibrary>
            <numberOfAvailableBooks>3</numberOfAvailableBooks>
        </number>
    </book>
</books>